"Q6FHK46V","journalArticle",2018,"Gafar, NA; Eyre, BD; Schulz, KG","A Conceptual Model for Projecting Coccolithophorid Growth, Calcification and Photosynthetic Carbon Fixation Rates in Response to Global Ocean Change","FRONTIERS IN MARINE SCIENCE",NA,"2296-7745","10.3389/fmars.2017.00433",NA,"Temperature, light and carbonate chemistry all influence the growth, calcification and photosynthetic rates of coccolithophores to a similar degree. There have been multiple attempts to project the responses of coccolithophores to changes in carbonate chemistry, but the interaction with light and temperature remains elusive. Here we devise a simple conceptual model to derive a fit equation for coccolithophorid growth, photosynthetic and calcification rates in response to simultaneous changes in carbonate chemistry, temperature and light conditions. The fit equation is able to account for up to 88% of the variability in measured metabolic rates. Equation projections indicate that temperature, light and carbonate chemistry all have different modulating effects on both optimal growth conditions and the sensitivity of responses to extreme environmental conditions. Calculations suggest that a single extreme environmental condition (CO2, temperature, light) will reduce maximum rates regardless of how optimal the other environmental conditions may be. Thus, while the response of coccolithophores to ocean change depends on multiple variables, the one which is least optimal will have the most impact on overall rates. Finally, responses to ocean change are usually reported in terms of cellular rates. However, changes in cellular rates can be a poor predictor for assessing changes in production at the community level. We therefore introduce a new metric, the calcium carbonate production potential (CCPP), which combines the independent effects of changes in growth rate and cellular calcium carbonate content to assess how environmental changes will impact coccolith production. Direct comparison of CO2 impacts on cellular CaCO3 production rates and CCPP shows that while the former is still at 45% of its pre-industrial capacity at 1,000 mu atm, the latter is reduced to 10%.","2018-01-04","2025-03-12 16:36:15","2025-03-12 16:36:15",NA,"",NA,"",4,NA,NA,NA,NA,NA,NA,NA,NA,NA,NA,NA,NA,NA,"WOS:000456914800001",NA,NA,NA,NA,NA,NA,NA,NA,NA,NA,NA,NA,NA,NA,NA,NA,NA,NA,NA,NA,NA,NA,NA,NA,NA,NA,NA,NA,NA,NA,NA,NA,NA,NA,NA,NA,NA,NA,NA,NA,NA,NA,NA,NA,NA,NA,NA,NA,NA,NA,NA,NA,NA,NA,"Reject","No reason given","No comments given","Hannah"
"4LFFU72D","journalArticle",2016,"Listmann, L; LeRoch, M; Schlter, L; Thomas, MK; Reusch, TBH","Swift thermal reaction norm evolution in a key marine phytoplankton species","EVOLUTIONARY APPLICATIONS",NA,"1752-4571","10.1111/eva.12362",NA,"Temperature has a profound effect on the species composition and physiology of marine phytoplankton, a polyphyletic group of microbes responsible for half of global primary production. Here, we ask whether and how thermal reaction norms in a key calcifying species, the coccolithophore Emiliania huxleyi, change as a result of 2.5 years of experimental evolution to a temperature approximate to 2 degrees C below its upper thermal limit. Replicate experimental populations derived from a single genotype isolated from Norwegian coastal waters were grown at two temperatures for 2.5 years before assessing thermal responses at 6 temperatures ranging from 15 to 26 degrees C, with pCO(2) (400/1100/2200 mu atm) as a fully factorial additional factor. The two selection temperatures (15 degrees/26.3 degrees C) led to a marked divergence of thermal reaction norms. Optimal growth temperatures were 0.7 degrees C higher in experimental populations selected at 26.3 degrees C than those selected at 15.0 degrees C. An additional negative effect of high pCO(2) on maximal growth rate (8% decrease relative to lowest level) was observed. Finally, the maximum persistence temperature (T-max) differed by 1-3 degrees C between experimental treatments, as a result of an interaction between pCO(2) and the temperature selection. Taken together, we demonstrate that several attributes of thermal reaction norms in phytoplankton may change faster than the predicted progression of ocean warming.","2016-10","2025-03-12 16:36:15","2025-03-12 16:36:15",NA,"1156-1164",NA,"9",9,NA,NA,NA,NA,NA,NA,NA,NA,NA,NA,NA,NA,NA,"WOS:000387763200011",NA,NA,NA,NA,NA,NA,NA,NA,NA,NA,NA,NA,NA,NA,NA,NA,NA,NA,NA,NA,NA,NA,NA,NA,NA,NA,NA,NA,NA,NA,NA,NA,NA,NA,NA,NA,NA,NA,NA,NA,NA,NA,NA,NA,NA,NA,NA,NA,NA,NA,NA,NA,NA,NA,"Accept","No reason given","No comments given","Hannah"
"PHLIHT93","journalArticle",2022,"Johnson, R; Langer, G; Rossi, S; Probert, I; Mammone, M; Ziveri, P","Nutritional response of a coccolithophore to changing pH and temperature","LIMNOLOGY AND OCEANOGRAPHY",NA,"0024-3590","10.1002/lno.12204",NA,"Coccolithophores are a calcifying unicellular phytoplankton group that are at the base of the marine food web, and their lipid content provides a source of energy to consumers. Coccolithophores are vulnerable to ocean acidification and warming, therefore it is critical to establish the effects of climate change on these significant marine primary producers, and determine potential consequences that these changes can have on their consumers. Here, we quantified the impact of changes in pH and temperature on the nutritional condition (lipid content, particulate organic carbon/nitrogen), growth rate, and morphology of the most abundant living coccolithophore species, Emiliania huxleyi. We used a regression type approach with nine pH levels (ranging from 7.66 to 8.44) and two temperatures (15 degrees C and 20 degrees C). Lipid production was greater under reduced pH, and growth rates were distinctly lower at 15 degrees C than at 20 degrees C. The production potential of lipids, which estimates the availability of lipids to consumers, increased under 20 degrees C, but decreased under low pH. The results indicate that, while consumers will benefit energetically under ocean warming, this benefit will be mitigated by ocean acidification. The carbon to nitrogen ratio was higher at 20 degrees C and low pH, indicating that the nutritional quality of coccolithophores for consumers will decline under climate change. The impact of low pH on the structural integrity of the coccosphere may also mean that coccolithophores are easier to digest for consumers. Many responses suggest cellular stress, indicating that increases in temperature and reductions in pH may have a negative impact on the ecophysiology of coccolithophores.","2022-10","2025-03-12 16:36:15","2025-03-12 16:36:15",NA,"2309-2324",NA,"10",67,NA,NA,NA,NA,NA,NA,NA,NA,NA,NA,NA,NA,NA,"WOS:000846459400001",NA,NA,NA,NA,NA,NA,NA,NA,NA,NA,NA,NA,NA,NA,NA,NA,NA,NA,NA,NA,NA,NA,NA,NA,NA,NA,NA,NA,NA,NA,NA,NA,NA,NA,NA,NA,NA,NA,NA,NA,NA,NA,NA,NA,NA,NA,NA,NA,NA,NA,NA,NA,NA,NA,"Accept","No reason given","No comments given","Hannah"
"QL5AYYNW","journalArticle",2002,"Stoll, HM; Klaas, CM; Probert, I; Encinar, JR; Alonso, JIG","Calcification rate and temperature effects on Sr partitioning in coccoliths of multiple species of coccolithophorids in culture","GLOBAL AND PLANETARY CHANGE",NA,"0921-8181","10.1016/S0921-8181(02)00112-1",NA,"Five common placolith-bearing coccolithophorid algae-Gephyrocapsa oceanica, Coccolithus pelagicus, Calcidiscus leptoporus, Umbilicosphaera sibogae (var. sibogae and var. foliosa), and Emiliania huxleyi-were cultured to investigate controls on Sr partitioning in coccolith calcite. For identical temperature and media composition, Sr partitioning varies by more than 30% in exponential phase cultures of the five species and is linearly related to rates of calcite production/cell (rho=0.91). Exponential phase culture experiments with three strains of C leptoporus and six strains of G. oceanica at varying temperatures show variations in Sr partitioning of 20% and 30%, respectively. With C leptoporus, Sr partitioning is equally correlated with temperature and calcification rate (rho=0.8), which themselves are highly correlated; the slope of the relationship between D-Sr and calcification rate is comparable to that observed in all species at constant temperature. However, in G. oceanica, increased temperature appears to enhance Sr incorporation by up to 2% to 1.6% degreesC(-1) in the range of 15 to 30 degreesC. The strong influence of calcification rate on Sr partitioning may be useful for inferring past variations in coccolithophorid productivity from Sr partitioning in coccolith sediments if the influence of temperature on Sr partitioning can be resolved. Because the relationship between calcite production and Sr partitioning is linear, a proportional change in calcification should be expressed much more strongly in the Sr/Ca ratio of large species with rapid calcite production than in smaller species, which produce calcite more slowly. Consequently, it may be possible to separate temperature and calcification influences on coccolith Sr/Ca by separately analyzing Sr/Ca in species that produce calcite rapidly and those that produce calcite slowly, if both undergo comparable relative changes in calcification rates. (C) 2002 Elsevier Science B.V. All rights reserved.","2002-11","2025-03-12 16:36:15","2025-03-12 16:36:15",NA,"153-171",NA,"3-4",34,NA,NA,NA,NA,NA,NA,NA,NA,NA,NA,NA,NA,NA,"WOS:000179711500003",NA,NA,NA,NA,NA,NA,NA,NA,NA,NA,NA,NA,NA,NA,NA,NA,NA,NA,NA,NA,NA,NA,NA,NA,NA,NA,NA,NA,NA,NA,NA,NA,NA,NA,NA,NA,NA,NA,NA,NA,NA,NA,NA,NA,NA,NA,NA,NA,NA,NA,NA,NA,NA,NA,"Reject","No reason given","No comments given","Hannah"
"BATZRUC3","journalArticle",2021,"Stelmakh, L; Kovrigina, N","Phytoplankton Growth Rate and Microzooplankton Grazing under Conditions of Climatic Changes and Anthropogenic Pollution in the Coastal Waters of the Black Sea (Sevastopol Region)","WATER",NA,"2073-4441","10.3390/w13223230",NA,"In the coastal waters of the Black Sea near Sevastopol, a gradual temperature elevation and an increase in anthropogenic pressure since the early 2000s have caused significant structural and functional changes in phytoplankton. Currently, there is a significant decrease in the contribution of small diatom species (Skeletonema sp. and Chaetoceros socialis H.S.Lauder as well as coccolithophorids Emiliania huxleyi (Lohmann) W.W.Hay and H.P.Mohler) to the total phytoplankton biomass in these waters. Previously these species caused regular weak blooms. In the warm periods (from May to October), during which the main phytoplankton biomass is formed, large diatom species Pseudosolenia calcar-avis (Schultze) B.G.Sundstrom, 1986, Proboscia alata (Brightwell) Sundstrom and dinoflagellates predominate. Therefore, the maximum values of the phytoplankton community's specific growth rate are about two times lower than in the preceding periods and do not exceed 1.10-1.40 day(-1). There was also a decrease observed in the microzooplankton grazing rate, which, during the year, was no higher than 0.70-1.20 day(-1). This is primarily conditioned by the increased role of large algae in phytoplankton, which means a decline in nutrition quality for microzooplankton. As a result of the joint influence of nutrition quality and water pollution, the relative share of net primary production consumed by microzooplankton in the warm periods of the year averaged only 32%, which is two times lower than the average values generally accepted for marine ecosystems. This means that the transfer of matter and energy from phytoplankton to higher trophic levels is significantly decreased.","2021-11","2025-03-12 16:36:15","2025-03-12 16:36:15",NA,"",NA,"22",13,NA,NA,NA,NA,NA,NA,NA,NA,NA,NA,NA,NA,NA,"WOS:000724793800001",NA,NA,NA,NA,NA,NA,NA,NA,NA,NA,NA,NA,NA,NA,NA,NA,NA,NA,NA,NA,NA,NA,NA,NA,NA,NA,NA,NA,NA,NA,NA,NA,NA,NA,NA,NA,NA,NA,NA,NA,NA,NA,NA,NA,NA,NA,NA,NA,NA,NA,NA,NA,NA,NA,"Reject","No reason given","No comments given","Hannah"
"PE9ZNQWS","journalArticle",2020,"Henderiks, J; Bartol, M; Pige, N; Karatsolis, BT; Lougheed, BC","Shifts in Phytoplankton Composition and Stepwise Climate Change During the Middle Miocene","PALEOCEANOGRAPHY AND PALEOCLIMATOLOGY",NA,"2572-4517","10.1029/2020PA003915",NA,"The abundance and composition of modern phytoplankton are primarily related to equator-to-pole temperature gradients and global ocean circulation, which in turn determine the availability of nutrients in the photic zone. The nutricline is found at greater depths in warm, tropical waters, whereas more vigorous surface mixing in higher latitudes (seasonally) enhances nutrient availability and primary productivity. Ocean temperatures were similar to 7 degrees C higher during the middle Miocene Climatic Optimum (MCO; similar to 16.9-14.7 million years ago, Ma), which was followed by Antarctic glaciation and global cooling during the middle Miocene Climate transition (MMCT; 14.7-13.8 Ma). Four decades ago, Haq (1980, ) already related migration patterns of low-latitude versus high-latitude calcareous nannoplankton in the Atlantic Ocean to major climatic fluctuations during the Miocene. Here, we detail and discuss the macroevolutionary patterns and processes across the middle Miocene (similar to 16.5-11 Ma) at five deep sea sites on a north-south transect in the Atlantic Ocean (57 degrees N to 28 degrees S). We show that the major cooling step toward the modern ""icehouse"" world impacted coccolithophore communities at all latitudes. Contrary to previous observations suggesting that tropical sites showed little change and that midlatitudes were the most sensitive recorders of climate change across the MMCT, we show that all sites recorded a marked diversification and increase in abundance of reticulofenestrids. Global cooling and related increased meridional overturning circulation are implicated as likely forcings for this macroevolutionary step toward establishing modern coccolithophore communities that are dominated by eurythermal and eurytrophic species such asEmiliania huxleyi. Plain Language Summary How will marine plankton communities respond to a much warmer world than today? How fast or slow would such changes be? We can learn valuable lessons from the fossil record of coccolithophores that represent a prominent phytoplankton group in both past and modern oceans. Changes in the composition of fossil assemblages show that species tracked past climate change on submillion year scales in the Atlantic Ocean. When ocean temperatures were similar to 7 degrees C warmer during the middle Miocene (similar to 16 million years ago), tropical species reached into the midlatitudes (42 degrees N) of the North Atlantic. When the Antarctic ice sheet grew larger and the oceans cooled after similar to 14.7 million years ago, a group known as the reticulofenestrids diversified and became the most common everywhere, also in the tropics. Apparently, this group maintained high fitness in an ""icehouse"" world with greater latitudinal temperature contrasts, more vigorous ocean circulation, and higher nutrient availability in the photic zone. Indeed, their cosmopolitan distribution implies broad temperature and other environmental tolerances, similar to the group's latest descendant, the modern species Emiliania huxleyi that also displays a wide genetic and ecophenotypic diversity.","2020-08","2025-03-12 16:36:15","2025-03-12 16:36:15",NA,"",NA,"8",35,NA,NA,NA,NA,NA,NA,NA,NA,NA,NA,NA,NA,NA,"WOS:000567508700002",NA,NA,NA,NA,NA,NA,NA,NA,NA,NA,NA,NA,NA,NA,NA,NA,NA,NA,NA,NA,NA,NA,NA,NA,NA,NA,NA,NA,NA,NA,NA,NA,NA,NA,NA,NA,NA,NA,NA,NA,NA,NA,NA,NA,NA,NA,NA,NA,NA,NA,NA,NA,NA,NA,"Reject","No reason given","No comments given","Hannah"
"FX9XJETY","journalArticle",2012,"Spielmeyer, A; Pohnert, G","Influence of temperature and elevated carbon dioxide on the production of dimethylsulfoniopropionate and glycine betaine by marine phytoplankton","MARINE ENVIRONMENTAL RESEARCH",NA,"0141-1136","10.1016/j.marenvres.2011.11.002",NA,"The sulfur metabolite dimethylsulfoniopropionate (DMSP) is the most important precursor of the climate relevant metabolite dimethylsulfide (DMS). It has thus gained interest in the context of climate change and several studies investigated the influence of elevated temperature and/or CO2 on DMSP in complex plankton communities. However, only little information about changes in response to these factors in single species is available. Therefore, we analyzed DMSP in different phytoplankton cultures (Thalassiosira pseudonana, Phaeodactylum tricornutum, Emiliania huxleyi) under the influence of increased temperature by 6 degrees C and elevated CO2 to 790 ppmv. In addition, we addressed glycine betaine (GBT) that fulfills a similar function as osmolyte like DMSP. In all cultures GBT concentrations increased at higher temperature and decreased at elevated CO2. In contrast, diatoms and prymnesiophytes revealed opposite trends for DMSP. In diatoms increased CO2 and temperature led to decreased DMSP concentrations, while rather elevated levels of this metabolite under the influence of these parameters were observed for E. huxleyi. (C) 2011 Elsevier Ltd. All rights reserved.","2012-02","2025-03-12 16:36:15","2025-03-12 16:36:15",NA,"62-69",NA,"",73,NA,NA,NA,NA,NA,NA,NA,NA,NA,NA,NA,NA,NA,"WOS:000300818900008",NA,NA,NA,NA,NA,NA,NA,NA,NA,NA,NA,NA,NA,NA,NA,NA,NA,NA,NA,NA,NA,NA,NA,NA,NA,NA,NA,NA,NA,NA,NA,NA,NA,NA,NA,NA,NA,NA,NA,NA,NA,NA,NA,NA,NA,NA,NA,NA,NA,NA,NA,NA,NA,NA,"Reject","No reason given","No comments given","Hannah"
"GYM4RVMH","journalArticle",2018,"Bach, LT; Lohbeck, KT; Reusch, TBH; Riebesell, U","Rapid evolution of highly variable competitive abilities in a key phytoplankton species","NATURE ECOLOGY & EVOLUTION",NA,"2397-334X","10.1038/s41559-018-0474-x",NA,"Climate change challenges plankton communities, but evolutionary adaptation could mitigate the potential impacts. Here, we tested with the phytoplankton species Emiliania huxleyi whether adaptation to a stressor under laboratory conditions leads to equivalent fitness gains in a more natural environment. We found that fitness advantages that had evolved under laboratory conditions were masked by pleiotropic effects in natural plankton communities. Moreover, new genotypes with highly variable competitive abilities evolved on timescales significantly shorter than climate change.","2018-04","2025-03-12 16:36:15","2025-03-12 16:36:15",NA,"611-613",NA,"4",2,NA,NA,NA,NA,NA,NA,NA,NA,NA,NA,NA,NA,NA,"WOS:000431612000013",NA,NA,NA,NA,NA,NA,NA,NA,NA,NA,NA,NA,NA,NA,NA,NA,NA,NA,NA,NA,NA,NA,NA,NA,NA,NA,NA,NA,NA,NA,NA,NA,NA,NA,NA,NA,NA,NA,NA,NA,NA,NA,NA,NA,NA,NA,NA,NA,NA,NA,NA,NA,NA,NA,"Reject","No reason given","No comments given","Hannah"
"DBD5NZUN","journalArticle",2022,"Seifert, M; Nissen, C; Rost, B; Hauck, J","Cascading effects augment the direct impact of CO2 on phytoplankton growth in a biogeochemical model","ELEMENTA-SCIENCE OF THE ANTHROPOCENE",NA,"2325-1026","10.1525/elementa.2021.00104",NA,"Atmospheric and oceanic CO2 concentrations are rising at an unprecedented rate. Laboratory studies indicate a positive effect of rising CO2 on phytoplankton growth until an optimum is reached, after which the negative impact of accompanying acidification dominates. Here, we implemented carbonate system sensitivities of phytoplankton growth into our global biogeochemical model FESOM-REcoM and accounted explicitly for coccolithophores as the group most sensitive to CO2. In idealized simulations in which solely the atmospheric CO2 mixing ratio was modified, changes in competitive fitness and biomass are not only caused by the direct effects of CO2, but also by indirect effects via nutrient and light limitation as well as grazing. These cascading effects can both amplify or dampen phytoplankton responses to changing ocean pCO(2) levels. For example, coccolithophore growth is negatively affected both directly by future pCO(2) and indirectly by changes in light limitation, but these effects are compensated by a weakened nutrient limitation resulting from the decrease in small-phytoplankton biomass. In the Southern Ocean, future pCO(2) decreases small-phytoplankton biomass and hereby the preferred prey of zooplankton, which reduces the grazing pressure on diatoms and allows them to proliferate more strongly. In simulations that encompass CO2-driven warming and acidification, our model reveals that recent observed changes in North Atlantic coccolithophore biomass are driven primarily by warming and not by CO2. Our results highlight that CO2 can change the effects of other environmental drivers on phytoplankton growth, and that cascading effects may play an important role in projections of future net primary production.","2022-09-16","2025-03-12 16:36:15","2025-03-12 16:36:15",NA,"",NA,"1",10,NA,NA,NA,NA,NA,NA,NA,NA,NA,NA,NA,NA,NA,"WOS:000870833700001",NA,NA,NA,NA,NA,NA,NA,NA,NA,NA,NA,NA,NA,NA,NA,NA,NA,NA,NA,NA,NA,NA,NA,NA,NA,NA,NA,NA,NA,NA,NA,NA,NA,NA,NA,NA,NA,NA,NA,NA,NA,NA,NA,NA,NA,NA,NA,NA,NA,NA,NA,NA,NA,NA,"Reject","No reason given","No comments given","Hannah"
"6CVHGQ9N","journalArticle",2011,"Fiorini, S; Middelburg, JJ; Gattuso, JP","TESTING THE EFFECTS OF ELEVATED pCO2 ON COCCOLITHOPHORES (PRYMNESIOPHYCEAE): COMPARISON BETWEEN HAPLOID AND DIPLOID LIFE STAGES","JOURNAL OF PHYCOLOGY",NA,"0022-3646","10.1111/j.1529-8817.2011.01080.x",NA,"The response of Emiliania huxleyi (Lohmann) W.W. Hay et H. Mohler, Calcidiscus leptoporus (G. Murray et V. H. Blackman) J. Schiller, and Syracosphaera pulchra Lohmann to elevated partial pressure of carbon dioxide (pCO(2)) was investigated in batch cultures. We reported on the response of both haploid and diploid life stages of these three species. Growth rate, cell size, particulate inorganic carbon (PIC), and particulate organic carbon (POC) of both life stages were measured at two different pCO(2) (400 and 760 parts per million [ppm]), and their organic and inorganic carbon production were calculated. The two life stages within the same species generally exhibited a similar response to elevated pCO(2), the response of the haploid stage being often more pronounced than that of the diploid stage. The growth rate was consistently higher at elevated pCO(2), but the response of other processes varied among species. Calcification rate of C. leptoporus and of S. pulchra did not change at elevated pCO(2), whereas it increased in E. huxleyi. POC production and cell size of both life stages of S. pulchra and of the haploid stage of E. huxleyi markedly decreased at elevated pCO(2). It remained unaltered in the diploid stage of E. huxleyi and C. leptoporus and increased in the haploid stage of the latter. The PIC:POC ratio increased in E. huxleyi and was constant in C. leptoporus and S. pulchra. Elevated pCO(2) has a significant effect on these three coccolithophore species, the haploid stage being more sensitive. This effect must be taken into account when predicting the fate of coccolithophores in the future ocean.","2011-12","2025-03-12 16:36:15","2025-03-12 16:36:15",NA,"1281-1291",NA,"6",47,NA,NA,NA,NA,NA,NA,NA,NA,NA,NA,NA,NA,NA,"WOS:000297880500007",NA,NA,NA,NA,NA,NA,NA,NA,NA,NA,NA,NA,NA,NA,NA,NA,NA,NA,NA,NA,NA,NA,NA,NA,NA,NA,NA,NA,NA,NA,NA,NA,NA,NA,NA,NA,NA,NA,NA,NA,NA,NA,NA,NA,NA,NA,NA,NA,NA,NA,NA,NA,NA,NA,"Reject","No reason given","No comments given","Hannah"
"ZKS8NCLT","journalArticle",2013,"Chevin, LM; Collins, S; Lefvre, F","Phenotypic plasticity and evolutionary demographic responses to climate change: taking theory out to the field","FUNCTIONAL ECOLOGY",NA,"0269-8463","10.1111/j.1365-2435.2012.02043.x",NA,"1. Rapid climate change both imposes strong selective pressures on natural populations - potentially reducing their growth rate and causing genetic evolution - and affects the physiology and development of individual organisms. Understanding and predicting the fates of populations under global change, including extinctions and geographical range shifts, requires analysing the interplay of these processes, which has long been a grey area in evolutionary biology. 2. We review recent theory on the interaction of phenotypic plasticity, genetic evolution and demography in environments that change in time or space. We then discuss the main limitations of the models and the difficulties in testing theoretical predictions in the wild, notably regarding changes in phenotypic selection, the evolution of (co)variances of reaction norm parameters, and transient dynamics. 3. We use two landmark examples of physiological responses to climate change - trees facing drier climate and extreme temperatures, and marine phytoplankton under rising CO2 - to highlight relatively neglected questions and indicate the theoretical and empirical challenges that they raise. These examples illustrate notably that age-specific patterns of plasticity and selection on the one hand, and changes in community interactions and functioning on the other hand, need to be further investigated theoretically and empirically for a better understanding of evolutionary demographic responses to climate change in the wild.","2013-08","2025-03-12 16:36:15","2025-03-12 16:36:15",NA,"966-979",NA,"4",27,NA,NA,NA,NA,NA,NA,NA,NA,NA,NA,NA,NA,NA,"WOS:000329303900014",NA,NA,NA,NA,NA,NA,NA,NA,NA,NA,NA,NA,NA,NA,NA,NA,NA,NA,NA,NA,NA,NA,NA,NA,NA,NA,NA,NA,NA,NA,NA,NA,NA,NA,NA,NA,NA,NA,NA,NA,NA,NA,NA,NA,NA,NA,NA,NA,NA,NA,NA,NA,NA,NA,"Reject","No reason given","No comments given","Hannah"
