"GN2SPY9F","journalArticle",2018,"Baker, KG; Radford, DT; Evenhuis, C; Kuzhiumparam, U; Ralph, PJ; Doblin, MA","Thermal niche evolution of functional traits in a tropical marine phototroph","JOURNAL OF PHYCOLOGY",NA,"0022-3646","10.1111/jpy.12759",NA,"Land-based plants and ocean-dwelling microbial phototrophs known as phytoplankton, are together responsible for almost all global primary production. Habitat warming associated with anthropogenic climate change has detrimentally impacted marine primary production, with the effects observed on regional and global scales. In contrast to slower-growing higher plants, there is considerable potential for phytoplankton to evolve rapidly with changing environmental conditions. The energetic constraints associated with adaptation in phytoplankton are not yet understood, but are central to forecasting how global biogeochemical cycles respond to contemporary ocean change. Here, we demonstrate a number of potential trade-offs associated with high-temperature adaptation in a tropical microbial eukaryote, Amphidinium massartii (dinoflagellate). Most notably, the population became high-temperature specialized (higher fitness within a narrower thermal envelope and higher thermal optimum), and had a greater nutrient requirement for carbon, nitrogen and phosphorus. Evidently, the energetic constraints associated with living at elevated temperature alter competiveness along other environmental gradients. While high-temperature adaptation led to an irreversible change in biochemical composition (i.e., an increase in fatty acid saturation), the mechanisms underpinning thermal evolution in phytoplankton remain unclear, and will be crucial to understanding whether the trade-offs observed here are species-specific or are representative of the evolutionary constraints in all phytoplankton.","2018-12","2025-03-12 16:36:15","2025-03-12 16:36:15",NA,"799-810",NA,"6",54,NA,NA,NA,NA,NA,NA,NA,NA,NA,NA,NA,NA,NA,"WOS:000454908500005",NA,NA,NA,NA,NA,NA,NA,NA,NA,NA,NA,NA,NA,NA,NA,NA,NA,NA,NA,NA,NA,NA,NA,NA,NA,NA,NA,NA,NA,NA,NA,NA,NA,NA,NA,NA,NA,NA,NA,NA,NA,NA,NA,NA,NA,NA,NA,NA,NA,NA,NA,NA,NA,NA,"Reject","No reason given","No comments given","Hannah"
"AIJJNXNG","journalArticle",2018,"Maranon, E; Lorenzo, MP; Cermeno, P; Mourino-Carballido, B","Nutrient limitation suppresses the temperature dependence of phytoplankton metabolic rates","ISME JOURNAL",NA,"1751-7362","10.1038/s41396-018-0105-1",NA,"Climate warming has the potential to alter ecosystem function through temperature-dependent changes in individual metabolic rates. The temperature sensitivity of phytoplankton metabolism is especially relevant, since these microorganisms sustain marine food webs and are major drivers of biogeochemical cycling. Phytoplankton metabolic rates increase with temperature when nutrients are abundant, but it is unknown if the same pattern applies under nutrient-limited growth conditions, which prevail over most of the ocean. Here we use continuous cultures of three cosmopolitan and biogeochemically relevant species (Synechococcus sp., Skeletonema costatum and Emiliania huxleyi) to determine the temperature dependence (activation energy, Ea) of metabolism under different degrees of nitrogen (N) limitation. We show that both CO2 fixation and respiration rates increase with N supply but are largely insensitive to temperature. Ea of photosynthesis (0.11 +/- 0.06 eV, mean +/- SE) and respiration (0.04 +/- 0.17 eV) under N-limited growth is significantly smaller than Ea of growth rate under nutrient-replete conditions (0.77 +/- 0.06 eV). The reduced temperature dependence of metabolic rates under nutrient limitation can be explained in terms of enzyme kinetics, because both maximum reaction rates and halfsaturation constants increase with temperature. Our results suggest that the direct, stimulating effect of rising temperatures upon phytoplankton metabolic rates will be circumscribed to ecosystems with high-nutrient availability.","2018-07","2025-03-12 16:36:15","2025-03-12 16:36:15",NA,"1836-1845",NA,"7",12,NA,NA,NA,NA,NA,NA,NA,NA,NA,NA,NA,NA,NA,"WOS:000436623600018",NA,NA,NA,NA,NA,NA,NA,NA,NA,NA,NA,NA,NA,NA,NA,NA,NA,NA,NA,NA,NA,NA,NA,NA,NA,NA,NA,NA,NA,NA,NA,NA,NA,NA,NA,NA,NA,NA,NA,NA,NA,NA,NA,NA,NA,NA,NA,NA,NA,NA,NA,NA,NA,NA,"Reject","No reason given","No comments given","Hannah"
"H6KI3V4X","journalArticle",2015,"Aloisi, G","Covariation of metabolic rates and cell size in coccolithophores","BIOGEOSCIENCES",NA,"1726-4170","10.5194/bg-12-4665-2015",NA,"Coccolithophores are sensitive recorders of environmental change. The size of their coccosphere varies in the ocean along gradients of environmental conditions and provides a key for understanding the fate of this important phytoplankton group in the future ocean. But interpreting field changes in coccosphere size in terms of laboratory observations is hard, mainly because the marine signal reflects the response of multiple morphotypes to changes in a combination of environmental variables. In this paper I examine the large corpus of published laboratory experiments with coccolithophores looking for relations between environmental conditions, metabolic rates and cell size (a proxy for coccosphere size). I show that growth, photosynthesis and, to a lesser extent, calcification covary with cell size when pCO(2), irradiance, temperature, nitrate, phosphate and iron conditions change. With the exception of phosphate and temperature, a change from limiting to non-limiting conditions always results in an increase in cell size. An increase in phosphate or temperature (below the optimum temperature for growth) produces the opposite effect. The magnitude of the coccosphere-size changes observed in the laboratory is comparable to that observed in the ocean. If the biological reasons behind the environment-metabolism-size link are understood, it will be possible to use coccosphere-size changes in the modern ocean and in marine sediments to investigate the fate of coccolithophores in the future ocean. This reasoning can be extended to the size of coccoliths if, as recent experiments are starting to show, coccolith size reacts to environmental change proportionally to coccosphere size. The coccolithophore database is strongly biased in favour of experiments with the coccolithophore Emiliania huxleyi (E. huxleyi; 82% of database entries), and more experiments with other species are needed to understand whether these observations can be extended to coccolithophores in general. I introduce a simple model that simulates the growth rate and the size of cells forced by nitrate and phosphate concentrations. By considering a simple rule that allocates the energy flow from nutrient acquisition to cell structure (biomass) and cell maturity (biological complexity, eventually leading to cell division), the model is able to reproduce the covariation of growth rate and cell size observed in laboratory experiments with E. huxleyi when these nutrients become limiting. These results support ongoing efforts to interpret coccosphere and coccolith size measurements in the context of climate change.","2015","2025-03-12 16:36:15","2025-03-12 16:36:15",NA,"4665-4692",NA,"15",12,NA,NA,NA,NA,NA,NA,NA,NA,NA,NA,NA,NA,NA,"WOS:000360003700008",NA,NA,NA,NA,NA,NA,NA,NA,NA,NA,NA,NA,NA,NA,NA,NA,NA,NA,NA,NA,NA,NA,NA,NA,NA,NA,NA,NA,NA,NA,NA,NA,NA,NA,NA,NA,NA,NA,NA,NA,NA,NA,NA,NA,NA,NA,NA,NA,NA,NA,NA,NA,NA,NA,"Reject","No reason given","No comments given","Hannah"
"XC4DR2MV","journalArticle",2016,"Schlter, L; Lohbeck, KT; Grger, JP; Riebesell, U; Reusch, TBH","Long-term dynamics of adaptive evolution in a globally important phytoplankton species to ocean acidification","SCIENCE ADVANCES",NA,"2375-2548","10.1126/sciadv.1501660",NA,"Marine phytoplankton may adapt to ocean change, such as acidification or warming, because of their large population sizes and short generation times. Long-term adaptation to novel environments is a dynamic process, and phenotypic change can take place thousands of generations after exposure to novel conditions. We conducted a long-term evolution experiment (4 years = 2100 generations), starting with a single clone of the abundant and widespread coccolithophore Emiliania huxleyi exposed to three different CO2 levels simulating ocean acidification (OA). Growth rates as a proxy for Darwinian fitness increased only moderately under both levels of OA [+3.4% and +4.8%, respectively, at 1100 and 2200 matm partial pressure of CO2 (PCO2)] relative to control treatments (ambient CO2, 400 matm). Long-term adaptation to OA was complex, and initial phenotypic responses of ecologically important traits were later reverted. The biogeochemically important trait of calcification, in particular, that had initially been restored within the first year of evolution was later reduced to levels lower than the performance of nonadapted populations under OA. Calcification was not constitutively lost but returned to control treatment levels when high CO2-adapted isolates were transferred back to present-day control CO2 conditions. Selection under elevated CO2 exacerbated a general decrease of cell sizes under long-term laboratory evolution. Our results show that phytoplankton may evolve complex phenotypic plasticity that can affect biogeochemically important traits, such as calcification. Adaptive evolution may play out over longer time scales (>1 year) in an unforeseen way under future ocean conditions that cannot be predicted from initial adaptation responses.","2016-07","2025-03-12 16:36:15","2025-03-12 16:36:15",NA,"",NA,"7",2,NA,NA,NA,NA,NA,NA,NA,NA,NA,NA,NA,NA,NA,"WOS:000381805300003",NA,NA,NA,NA,NA,NA,NA,NA,NA,NA,NA,NA,NA,NA,NA,NA,NA,NA,NA,NA,NA,NA,NA,NA,NA,NA,NA,NA,NA,NA,NA,NA,NA,NA,NA,NA,NA,NA,NA,NA,NA,NA,NA,NA,NA,NA,NA,NA,NA,NA,NA,NA,NA,NA,"Reject","No reason given","No comments given","Hannah"
"9J4K5HIY","journalArticle",2012,"Lohbeck, KT; Riebesell, U; Reusch, TBH","Adaptive evolution of a key phytoplankton species to ocean acidification","NATURE GEOSCIENCE",NA,"1752-0894","10.1038/NGEO1441",NA,"Ocean acidification, the drop in seawater pH associated with the ongoing enrichment of marine waters with carbon dioxide from fossil fuel burning, may seriously impair marine calcifying organisms. Our present understanding of the sensitivity of marine life to ocean acidification is based primarily on short-term experiments, in which organisms are exposed to increased concentrations of CO2. However, phytoplankton species with short generation times, in particular, may be able to respond to environmental alterations through adaptive evolution. Here, we examine the ability of the world's single most important calcifying organism, the coccolithophore Emiliania huxleyi, to evolve in response to ocean acidification in two 500-generation selection experiments. Specifically, we exposed E. huxleyi populations founded by single or multiple clones to increased concentrations of CO2. Around 500 asexual generations later we assessed their fitness. Compared with populations kept at ambient CO2 partial pressure, those selected at increased partial pressure exhibited higher growth rates, in both the single-and multiclone experiment, when tested under ocean acidification conditions. Calcification was partly restored: rates were lower under increased CO2 conditions in all cultures, but were up to 50% higher in adapted compared with non-adapted cultures. We suggest that contemporary evolution could help to maintain the functionality of microbial processes at the base of marine food webs in the face of global change.","2012-05","2025-03-12 16:36:15","2025-03-12 16:36:15",NA,"346-351",NA,"5",5,NA,NA,NA,NA,NA,NA,NA,NA,NA,NA,NA,NA,NA,"WOS:000303464100016",NA,NA,NA,NA,NA,NA,NA,NA,NA,NA,NA,NA,NA,NA,NA,NA,NA,NA,NA,NA,NA,NA,NA,NA,NA,NA,NA,NA,NA,NA,NA,NA,NA,NA,NA,NA,NA,NA,NA,NA,NA,NA,NA,NA,NA,NA,NA,NA,NA,NA,NA,NA,NA,NA,"Reject","No reason given","No comments given","Hannah"
"BBAD8U7I","journalArticle",2017,"Krumhardt, KM; Lovenduski, NS; Iglesias-Rodriguez, MD; Kleypas, JA","Coccolithophore growth and calcification in a changing ocean","PROGRESS IN OCEANOGRAPHY",NA,"0079-6611","10.1016/j.pocean.2017.10.007",NA,"Coccolithophores are the most abundant calcifying phytoplankton in the ocean. These tiny primary producers have an important role in the global carbon cycle, substantially contributing to global ocean calcification, ballasting organic matter to the deep sea, forming part of the marine food web base, and influencing ocean atmosphere CO2 exchange. Despite these important impacts, coccolithophores are not explicitly simulated in most marine ecosystem models and, therefore, their impacts on carbon cycling are not represented in most Earth system models. Here, we compile field and laboratory data to synthesize overarching, across-species relationships between environmental conditions and coccolithophore growth rates and relative calcification (reported as a ratio of particulate inorganic carbon to particulate organic carbon in coccolithophore biomass, PIC/POC). We apply our relationships in a generalized coccolithophore model, estimating current surface ocean coccolithophore growth rates and relative calcification, and projecting how these may change over the 21st century using output from the Community Earth System Model large ensemble. We find that average increases in sea surface temperature of similar to 2-3 degrees C lead to faster coccolithophore growth rates globally (>10% increase) and increased calcification at high latitudes. Roughly an ubiquitous doubling of surface ocean pCO(2) by the end of the century has the potential to moderately stimulate coccolithophore growth rates, but leads to reduced calcification (similar to 25% decrease). Decreasing nutrient availability (from warming-induced increases in stratification) produces increases in relative calcification, but leads to similar to 25% slower growth rates. With all drivers combined, we observe decreases in calcification and growth in most low and mid latitude regions, with possible increases in both of these responses in most high latitude regions. Major limitations of our coccolithophore model stem from a lack of conclusive physiological responses to changes in irradiance (we do not include light limitation in our model), and a lack of physiological data for major coccolithophore species. Species within the Umbellosphaera genus, for example, are dominant in mid to low latitude regions where we predict some of the largest decreases in coccolithophore growth rate and calcification.","2017-12","2025-03-12 16:36:15","2025-03-12 16:36:15",NA,"276-295",NA,"",159,NA,NA,NA,NA,NA,NA,NA,NA,NA,NA,NA,NA,NA,"WOS:000418980600018",NA,NA,NA,NA,NA,NA,NA,NA,NA,NA,NA,NA,NA,NA,NA,NA,NA,NA,NA,NA,NA,NA,NA,NA,NA,NA,NA,NA,NA,NA,NA,NA,NA,NA,NA,NA,NA,NA,NA,NA,NA,NA,NA,NA,NA,NA,NA,NA,NA,NA,NA,NA,NA,NA,"Reject","No reason given","No comments given","Hannah"
"TZ5U7CC5","journalArticle",2025,"Liang, X; Raven, JA; Beardall, J; Overmans, S; Xia, JR; Jin, P","The trade-offs associated with the adaptions of marine microalgae to high CO2 and warming","MARINE ENVIRONMENTAL RESEARCH",NA,"0141-1136","10.1016/j.marenvres.2024.106853",NA,"Trade-offs play vital roles in evolutionary theory, linking organism performance to changing environments in the context of global change. Marine microalgae, as one of the most important groups of primary producers in the biosphere, exhibit significant trade-offs across multiple traits in response to environmental changes, such as elevated CO2 (and consequent ocean acidification) and warming. In this review, we synthesize recent findings on the trade-offs associated with both short-term phenotypic acclimation and long-term genotypic adaptation of marine microalgae. Specifically, we discuss distinct classes of trade-offs (i.e., allocation trade-offs, acquisition trade-offs and specialist-generalist trade-offs) between multiple traits, such as growth rate, photosynthesis, nutrient acquisition, and stress tolerance. We also explored the underlying mechanisms driving these trade-offs. Finally, we discuss the broader ecological consequences of these trade-offs, such as potential shifts in species composition and ecosystem functions, and outline key research directions to better predict marine ecosystem responses to future global change scenarios.","2025-02","2025-03-12 16:36:15","2025-03-12 16:36:15",NA,"",NA,"",204,NA,NA,NA,NA,NA,NA,NA,NA,NA,NA,NA,NA,NA,"WOS:001363181900001",NA,NA,NA,NA,NA,NA,NA,NA,NA,NA,NA,NA,NA,NA,NA,NA,NA,NA,NA,NA,NA,NA,NA,NA,NA,NA,NA,NA,NA,NA,NA,NA,NA,NA,NA,NA,NA,NA,NA,NA,NA,NA,NA,NA,NA,NA,NA,NA,NA,NA,NA,NA,NA,NA,"Reject","No reason given","No comments given","Hannah"
"5LJ5NYXH","journalArticle",2018,"Li, FT; Beardall, J; Gao, KS","Diatom performance in a future ocean: interactions between nitrogen limitation, temperature, and CO2-induced seawater acidification","ICES JOURNAL OF MARINE SCIENCE",NA,"1054-3139","10.1093/icesjms/fsx239",NA,"Phytoplankton cells living in the surface waters of oceans are experiencing alterations in environmental conditions associated with global change Given their importance in global primary productivity, it is of considerable concern to know how these organisms will perform physiologically under the changing levels of pH, temperatures, and nutrients predicted for future oceanic ecosystems. Here we show that the model diatom, Thalassiosira pseudonana, when grown at different temperatures (20 or 24 degrees C), pCO(2) (400 or 1000 mu atm), and nitrate concentrations (2.5 or102.5 mu moll(1)), displayed contrasting performance in its physiology. Elevated pCO(2) (and hence seawater acidification) under the nitrate-limited conditions led to decreases in specific growth rate, cell size, pigment content, photochemical quantum yield of PSII, and photosynthetic carbon fixation. Furthermore, increasing the temperature exacerbated the negative effects of the seawater acidification associated with elevated pCO(2) on specific growth rate and chlorophyll content under the N-limited conditions These results imply that a reduced upward transport of nutrients due to enhanced stratification associated with ocean warming might act synergistically to reduce growth and carbon fixation by diatoms under progressive ocean acidification, with important ramifications for ocean productivity and the strength of the biological CO2 pump.","2018-07","2025-03-12 16:36:15","2025-03-12 16:36:15",NA,"1451-1464",NA,"4",75,NA,NA,NA,NA,NA,NA,NA,NA,NA,NA,NA,NA,NA,"WOS:000439700800022",NA,NA,NA,NA,NA,NA,NA,NA,NA,NA,NA,NA,NA,NA,NA,NA,NA,NA,NA,NA,NA,NA,NA,NA,NA,NA,NA,NA,NA,NA,NA,NA,NA,NA,NA,NA,NA,NA,NA,NA,NA,NA,NA,NA,NA,NA,NA,NA,NA,NA,NA,NA,NA,NA,"Reject","No reason given","No comments given","Hannah"
"BFB7M5DW","journalArticle",2014,"Balch, WM; Bowler, BC; Lubelczyk, LC; Stevens, MW","Aerial extent, composition, bio-optics and biogeochemistry of a massive under-ice algal bloom in the Arctic","DEEP-SEA RESEARCH PART II-TOPICAL STUDIES IN OCEANOGRAPHY",NA,"0967-0645","10.1016/j.dsr2.2014.04.001",NA,"It has been long thought that coccolithophores are a minor component of the phytoplankton assemblage in Arctic waters, with diatoms typically being more dominant. Little is known about how the phytoplankton communities will change, however, as the Arctic warms. We participated in the 2011 Impacts of Climate on EcoSystems and Chemistry of the Arctic Pacific Environment (ICESCAPE) cruise to the western Arctic, performing a combination of discrete measurements (microscopy, calcification, particulate inorganic carbon (PIC), particulate organic carbon (POC), biogenic silica (BSi)) plus continuous surface bio-optical measurements (absorption, scattering, backscattering and acid-labile backscattering; the latter specific for coccolithophores). Here, we report bio-optical and coccolithophore observations from the massive under-ice algal bloom originally described in Arrigo et al. (2012). The most intense portions of the bloom were centered in cold Winter Water and there was evidence for nitrate drawdown in the top 10-20 m with strong penetration of silicate rich water into the surface waters. Surface chlorophyll alpha and particulate absorption at 440 nm approached 30 mu g L-1 and 1.0 m(-1), respectively. Particulate absorption of detritus (alpha(p) at 412 nm) was highly correlated to alpha(p) at 440 nm associated with chlorophyll a and slopes of the absorption spectrum showed that both dissolved and particulate absorption at 412 nm exceeded that at 440 nm, with slopes, S-g, of 0.01 nm(-1). Colored dissolved organic matter fluorescence (FDOM) was high in the bloom but the relative fluorescence yields were low, characteristic of phytoplankton-produced FDOM (as opposed to terrestrially-produced FDOM). Coccolithophore backscattering was elevated in the under-ice bloom, but it only accounted for 10% of the total particle backscattering, relatively low compared to typical subpolar waters further to the south. Total particle scattering was significantly elevated in the under-ice bloom (values of almost 2 m(-1)), likely due to the high abundance of large diatoms. Backscattering probabilities in the bloom were similar to 1%, again characteristic of diatom-dominated populations with few calcifiers. PIC standing stock in the under-ice bloom was low but measurable while biogenic silica molar concentrations were 150 times greater. POC: PON molar ratios were 6-10, characteristic of healthy, rapidly growing phytoplankton, observations further buttressed by carbon:chlorophyll mass ratios of 50-100. Coccolithophore calcification was low but measurable, reaching 1.75 mg C m(-3) d(-1) in the under-ice bloom, only 0.4% of the photosynthesis. However, the intrinsic carbon-specific growth rate was 0.4 per day for bulk POC and similar to 1 per day for bulk PIC, close to maximal growth rates expected at these temperatures. SEM and light microscopy results showed mostly diatoms in the bloom. The coccolithophore, Emiliania huxleyi, was observed, providing unequivocal evidence of the presence of coccolithophores in the under-ice algal bloom. (C) 2014 The Authors. Published by Elsevier Ltd.","2014-07","2025-03-12 16:36:15","2025-03-12 16:36:15",NA,"42-58",NA,"",105,NA,NA,NA,NA,NA,NA,NA,NA,NA,NA,NA,NA,NA,"WOS:000338978700004",NA,NA,NA,NA,NA,NA,NA,NA,NA,NA,NA,NA,NA,NA,NA,NA,NA,NA,NA,NA,NA,NA,NA,NA,NA,NA,NA,NA,NA,NA,NA,NA,NA,NA,NA,NA,NA,NA,NA,NA,NA,NA,NA,NA,NA,NA,NA,NA,NA,NA,NA,NA,NA,NA,"Reject","No reason given","No comments given","Hannah"
"UKQPQPKD","journalArticle",2018,"Jin, XB; Liu, CL; Zhang, HR; Zhou, C; Jiang, XY; Wu, ZY; Xu, J","Evolutionary driven of Gephyrocapsa coccolith isotopic vital effects over the past 400 ka","EARTH AND PLANETARY SCIENCE LETTERS",NA,"0012-821X","10.1016/j.epsl.2018.09.010",NA,"Coccolithophores play important roles in marine biochemistry due to the processes of calcification and photosynthesis. Coccoliths are produced intracellularly, and cells produce coccoliths with stable isotopes distinct from theoretically precipitated inorganic calcite due to the influences of coccolithophore physiology, which are the so-called vital effects. The coccolith isotopic vital effects show large variations between species and hamper the use of coccolith isotopes in paleoceanography. In addition, learning the coccolith isotopic vital effects can help to better understand the carbon fractionation in coccolithophore cell, so as to provide a new insight in reconstructing sea water carbonate system (e.g., from alkenone delta C-13 or directly from coccolith delta C-13) in geological past. In the present study, we investigated the morphological parameters, growth rate, and coccolith stable isotope compositions of Gephyrocapsa, the most universal alkenone-producing coccolithophore across the Pleistocene. These data allow us to estimate the influences of Gephyrocapsa morphology as well as the growth rate on coccolith vital effects. The results showed that Gephyrocapsa morphology, as well as coccolith isotopes, varied with species and morphotype changes, which were evolutionarily forced over the past 400 ka. The small Gephyrocapsa morphotypes (G. caribbeanica and Gephyrocapsa <3 mu m) produced more robust coccoliths with relatively heavier isotopes for both carbon and oxygen than that of the larger-sized G. oceanica. The carbon and oxygen vital effects were significantly correlated and showed negative values, suggesting a kinetic effect on bicarbonate formation during calcification. The Gephyrocapsa growth rate showed a glacial-interglacial cyclicality, and had close relations with coccolith isotopic vital effects before MIS 8 when G. oceanica dominated. It is suggested that coccolith isotopic fractionation were influenced by coccolithophore growth rate, however these effects were superimposed on an evolutionary forced coccolithophore (coccolith) size changes. (C) 2018 Elsevier B.V. All rights reserved.","2018-12-01","2025-03-12 16:36:15","2025-03-12 16:36:15",NA,"236-247",NA,"",503,NA,NA,NA,NA,NA,NA,NA,NA,NA,NA,NA,NA,NA,"WOS:000449246100022",NA,NA,NA,NA,NA,NA,NA,NA,NA,NA,NA,NA,NA,NA,NA,NA,NA,NA,NA,NA,NA,NA,NA,NA,NA,NA,NA,NA,NA,NA,NA,NA,NA,NA,NA,NA,NA,NA,NA,NA,NA,NA,NA,NA,NA,NA,NA,NA,NA,NA,NA,NA,NA,NA,"Reject","No reason given","No comments given","Hannah"
