"SAY25RM8","journalArticle",2016,"Bill, BD; Moore, SK; Hay, LR; Anderson, DM; Trainer, VL","Effects of temperature and salinity on the growth of Alexandrium (Dinophyceae) isolates from the Salish Sea","JOURNAL OF PHYCOLOGY","","0022-3646","10.1111/jpy.12386",NA,"Toxin-producing blooms of dinoflagellates in the genus Alexandrium have plagued the inhabitants of the Salish Sea for centuries. Yet the environmental conditions that promote accelerated growth of this organism, a producer of paralytic shellfish toxins, is lacking. This study quantitatively determined the growth response of two Alexandrium isolates to a range of temperatures and salinities, factors that will strongly respond to future climate change scenarios. An empirical equation, derived from observed growth rates describing the temperature and salinity dependence of growth, was used to hindcast bloom risk. Hindcasting was achieved by comparing predicted growth rates, calculated from insitu temperature and salinity data from Quartermaster Harbor, with corresponding Alexandrium cell counts and shellfish toxin data. The greatest bloom risk, defined at >0.25d(-1), generally occurred from April through November annually; however, growth rates rarely fell below 0.10d(-1). Except for a few occasions, Alexandrium cells were only observed during the periods of highest bloom risk and paralytic shellfish toxins above the regulatory limit always fell within the periods of predicted bloom occurrence. While acknowledging that Alexandrium growth rates are affected by other abiotic and biotic factors, such as grazing pressure and nutrient availability, the use of this empirical growth function to predict higher risk time frames for blooms and toxic shellfish within the Salish Sea provides the groundwork for a more comprehensive biological model of Alexandrium bloom dynamics in the region and will enhance our ability to forecast blooms in the Salish Sea under future climate change scenarios.","2016-04","2025-03-05 14:40:27","2025-03-05 14:40:27",NA,"230-238",NA,"2",52,NA,NA,NA,"",NA,NA,NA,NA,NA,"English",NA,NA,NA,"WOS:000373618400008",NA,NA,"","<p>Times Cited in Web of Science Core Collection:&nbsp;&nbsp;37<br/>Total Times Cited:&nbsp;&nbsp;41<br/>Cited Reference Count:&nbsp;&nbsp;35</p>",NA,NA,"ACCUMULATION; Alexandrium; GONYAULAX-TAMARENSIS; growth rate; HAB; harmful algae; hindcast; IRRADIANCE; NARRAGANSETT BAY; PARALYTIC SHELLFISH; PATTERNS; Puget Sound; PUGET-SOUND; salinity; Salish Sea; temperature; TOXICITY; TOXINS; WASHINGTON",NA,"",NA,NA,NA,NA,NA,NA,NA,NA,NA,NA,NA,NA,NA,NA,NA,NA,NA,NA,NA,NA,NA,NA,NA,NA,NA,NA,NA,NA,NA,NA,NA,NA,NA,NA,NA,NA,NA,NA,NA,NA,NA,NA,NA,NA,NA,"Accept","No reason given","No comments given","Insert Screener Name","Dinoflagellates"
"KSTXGBUL","journalArticle",2024,"Funaki, C; Kuwata, K; Lum, WM; Takahashi, K; Masuda, T; Ichinomiya, M; Katayama, T; Kodama, T; Iwataki, M; Takahashi, K","Effects of temperature and light intensity on growth in Prorocentrum cf. balticum (Dinophyceae) isolated from the Oyashio-Kuroshio Mixed Water region, North Pacific","PLANKTON & BENTHOS RESEARCH","","1880-8247","10.3800/pbr.19.191",NA,"Owing to its particular mixotrophic nutrition, Prorocentrum cf. balticum has recently been suggested to contribute significantly to the biological pump in the world's oceans. However, the physiological attributes that facilitate its distribution have not yet been investigated. We clarified the effects of temperature and light intensity on the growth of a strain of P. cf. balticum isolated from the Oyashio-Kuroshio Mixed Water region and then estimated its potential habitat in the western North Pacific in the context of global warming. In batch cultures maintained at 5 degrees C30 degrees C, the highest growth was observed at 25 degrees C, while the viable temperature range was estimated to be 6.03 degrees C-29.4 degrees C. At the six different light conditions tested (20-500 mu mol m-2 s-1), growth rates were positively correlated with light intensity, except at 500 mu mol m-2 s-1 where photoinhibition was observed. At 20 degrees C, the maximum specific growth rate was calculated to be 0.661 day-1 and the compensation light intensity and the saturation light intensity were 1.15 and 283 mu mol m-2 s-1, respectively. These findings suggested that compared to other Prorocentrum species, P. cf. balticum is generally well suited to subtropical environments characterized by high light intensities. However, the potential to survive in mid-latitude environments that experience low temperatures during winter suggests a high probability of year-round occurrence at higher latitudes, including the Oyashio region, in the future.","2024-11","2025-03-05 14:40:27","2025-03-05 14:40:27",NA,"191-202",NA,"4",19,NA,NA,NA,"",NA,NA,NA,NA,NA,"English",NA,NA,NA,"WOS:001369080700004",NA,NA,"","<p>Times Cited in Web of Science Core Collection:&nbsp;&nbsp;0<br/>Total Times Cited:&nbsp;&nbsp;0<br/>Cited Reference Count:&nbsp;&nbsp;71</p>",NA,NA,"BLOOM; COMMUNITY; FOOD-WEB; global warming; IRRADIANCE; light intensity; MARINE DINOFLAGELLATE; MINIMUM; OKADAIC ACID; PHYTOPLANKTON COMPOSITION; potential habitat; Prorocentrum balticum; SALINITY; SEA; specific growth rate; temperature",NA,"",NA,NA,NA,NA,NA,NA,NA,NA,NA,NA,NA,NA,NA,NA,NA,NA,NA,NA,NA,NA,NA,NA,NA,NA,NA,NA,NA,NA,NA,NA,NA,NA,NA,NA,NA,NA,NA,NA,NA,NA,NA,NA,NA,NA,NA,"Accept","No reason given","No comments given","Insert Screener Name","Dinoflagellates"
"AHXXYZYX","journalArticle",2021,"Acheampong, E; Mantey, P; Weremfo, A","Potential impact of marine heatwaves on selected phytoplankton adapted to the Gulf of Guinea during stable hydrographic periods","AFRICAN JOURNAL OF MARINE SCIENCE","","1814-232X","10.2989/1814232X.2021.1879267",NA,"Reports suggest that the Gulf of Guinea (northeastern tropical Atlantic) frequently experiences marine heatwaves (MHW)-prolonged periods of anomalously warm seawater-of >= 1.5 degrees C above baseline. We assessed the likely impact of this anomaly on two microalgae, Thalassiosira weissflogii (diatom) and Gymnodinium sp. (dinoflagellate), adapted to the surface temperature (28 +/- 1.5 degrees C) of the gulf during stable hydrographic periods. The algae were adapted over similar to 400 generations. They were assessed for specific growth rate (mu), dry weight, and protein content after exposure to 5 or 6 days of warming (+2 degrees C or +4 degrees C above the temperature of the stock cultures), in line with the minimum duration of MHW. Under each of the investigated warming scenarios, the effect of warming on the diatom was immediate, occurring during the first day of exposure, and mu had decreased by similar to 75% by the end of the warming period. In contrast, the warming effect on the dinoflagellate became significant during the second day, with mu reduced by similar to 78-86%. Also, the protein content of the dinoflagellate had been reduced by similar to 32% by the end of the warming period. The dry weight of T. weissflogii increased three-fold under +2 degrees C of warming. In contrast, the dry weight of Gymnodinium sp. decreased by similar to 78% and did not recover when warming was removed. These results highlight vulnerability of these algae to MHW and their unique responses to the anomaly.","2021-01-02","2025-03-05 14:40:27","2025-03-05 14:40:27",NA,"77-86",NA,"1",43,NA,NA,NA,"",NA,NA,NA,NA,NA,"English",NA,NA,NA,"WOS:000623977400001",NA,NA,"","<p>Times Cited in Web of Science Core Collection:&nbsp;&nbsp;5<br/>Total Times Cited:&nbsp;&nbsp;5<br/>Cited Reference Count:&nbsp;&nbsp;75</p>",NA,NA,"dry weight; GROWTH; Gymnodinium sp; laboratory experiment; marine microalgae; protein content; specific growth rate; TEMPERATURE; temperature effect; Thalassiosira weissflogii",NA,"",NA,NA,NA,NA,NA,NA,NA,NA,NA,NA,NA,NA,NA,NA,NA,NA,NA,NA,NA,NA,NA,NA,NA,NA,NA,NA,NA,NA,NA,NA,NA,NA,NA,NA,NA,NA,NA,NA,NA,NA,NA,NA,NA,NA,NA,"Accept","No reason given","No comments given","Insert Screener Name","Dinoflagellates"
"MRIHR7L7","journalArticle",2011,"Jephson, T; Fagerberg, T; Carlsson, P","Dependency of dinoflagellate vertical migration on salinity stratification","AQUATIC MICROBIAL ECOLOGY","","0948-3055","10.3354/ame01498",NA,"Increasing precipitation and surface water temperature due to global change may strengthen the salinity gradient in coastal regions, which could influence the behaviour of dinoflagellate migration. We studied diel vertical migration (DVM) behaviour in the dinoflagellates Prorocentrum minimum and Heterocapsa triquetra using vertically stratified laboratory columns with 3 different salinity gradients (difference of 6, 11 and 16 psu). With nutrient-depleted conditions at the surface, and with nutrients added below the halocline, P. minimum remained mainly concentrated in the bottom water, while H. triquetra performed DVM under all 3 salinity treatments. H. triquetra migrated through a salinity difference of 6 and 11 psu, concentrated at the surface at noon, then migrated to the nutrient-rich bottom water during the night. A salinity gradient of 16, however, stopped H. triquetra cells from moving through the gradient and resulted in a concentration of cells in the cline during the night. At midday, cells were again found at the surface. P. minimum and H. triquetra grown in 4 different salinities (10, 15, 20, 26 psu) and at 3 different temperatures (10, 15, 20 degrees C) showed higher specific growth rates with increasing temperature only in the 2 highest salinity treatments. At 10 degrees C, specific growth rates were not affected by different salinities.","2011","2025-03-05 14:40:27","2025-03-05 14:40:27",NA,"255-264",NA,"3",63,NA,NA,NA,"",NA,NA,NA,NA,NA,"English",NA,NA,NA,"WOS:000291057400005",NA,NA,"","<p>Times Cited in Web of Science Core Collection:&nbsp;&nbsp;14<br/>Total Times Cited:&nbsp;&nbsp;17<br/>Cited Reference Count:&nbsp;&nbsp;69</p>",NA,NA,"CELL-DIVISION; CLIMATE-CHANGE; DIEL; Dinoflagellate; DINOPHYCEAE; Global change; GROWTH; Growth rate; HARMFUL ALGAL BLOOMS; Heterocapsa triquetra; HETEROSIGMA-AKASHIWO; LONG-TERM CHANGES; NORTH-SEA; PHYTOPLANKTON; Prorocentrum minimum; Salinity; Stratification; Temperature; Vertical distribution",NA,"",NA,NA,NA,NA,NA,NA,NA,NA,NA,NA,NA,NA,NA,NA,NA,NA,NA,NA,NA,NA,NA,NA,NA,NA,NA,NA,NA,NA,NA,NA,NA,NA,NA,NA,NA,NA,NA,NA,NA,NA,NA,NA,NA,NA,NA,"Accept","No reason given","No comments given","Insert Screener Name","Dinoflagellates"
"L6FUA9VE","journalArticle",2019,"Seto, DS; Karp-Boss, L; Wells, ML","Effects of increasing temperature and acidification on the growth and competitive success of Alexandrium catenella from the Gulf of Maine","HARMFUL ALGAE","","1568-9883","10.1016/j.hal.2019.101670",NA,"Climate driven increases in ocean temperature and pCO(2) have the potential to alter the growth and prevalence of future Harmful Algal Blooms (HABs), but systematic studies on how climate drivers influence toxic algal species relative to non-toxic phytoplankton are lacking. In particular, little is known about how future climate scenarios will affect the growth of the toxic dinoflagellate Alexandrium catenella, which is responsible for the paralytic shellfish poisoning (PSP) events that threaten the health and economy of coastal communities in the Gulf of Maine and elsewhere. The growth responses of A. catenella and two other naturally co-occurring dinoflagellates in the Gulf of Maine-Scrippsiella sp., and Amphidinium carterae-were studied in mono and mixed species cultures. Experimental treatments tested the effects of elevated temperature (20 degrees C), lower pH (7.8), and the combination of elevated temperature and lower pH on growth rates relative to those in near-current conditions (15 degrees C; pH 8.1). Growth rates of A. catenella decreased under elevated temperature and' lower pH conditions, a response that was largely attributable to the effect of temperature. In contrast, growth rates of Scrippsiella sp. and A. carterae increased under elevated temperature and lower pH conditions, with temperature, also .being the primary driver of the response. These trends did not change substantially when these species were grown in mixed cultures (A. catenella + Scrippsiella sp., and A. catenella + A. carterae), indicating that allelopathic or competitive interactions did not affect the experimental outcome under the conditions tested. These findings suggest that A. catenella blooms may become less prevalent in the southern regions of the Gulf of Maine, but potentially more prevalent in the northeastern regions of the Gulf of Maine with continued climate change.","2019-11","2025-03-05 14:40:27","2025-03-05 14:40:27",NA,"",NA,"",89,NA,NA,NA,"",NA,NA,NA,NA,NA,"English",NA,NA,NA,"WOS:000496874100016",NA,NA,"","<p>Times Cited in Web of Science Core Collection:&nbsp;&nbsp;16<br/>Total Times Cited:&nbsp;&nbsp;17<br/>Cited Reference Count:&nbsp;&nbsp;62</p>",NA,NA,"ADAPTATION; Alexandrium; Amphidinium; CARBON ACQUISITION; Climate change; CLIMATE-CHANGE; CO2; DIATOM; FUNDYENSE; Growth rate; Gulf of Maine; HAB; HARMFUL ALGAL BLOOMS; Multi-stressor; Ocean acidification; OCEAN ACIDIFICATION; PCO(2); PH; Scrippsiella; Temperature; VARIABILITY",NA,"",NA,NA,NA,NA,NA,NA,NA,NA,NA,NA,NA,NA,NA,NA,NA,NA,NA,NA,NA,NA,NA,NA,NA,NA,NA,NA,NA,NA,NA,NA,NA,NA,NA,NA,NA,NA,NA,NA,NA,NA,NA,NA,NA,NA,NA,"Accept","No reason given","No comments given","Insert Screener Name","Dinoflagellates"
"A4GRSPIU","journalArticle",2019,"Deschaseaux, E; O'Brien, J; Siboni, N; Petrou, K; Seymour, JR","Shifts in dimethylated sulfur concentrations and microbiome composition in the red-tide causing dinoflagellate Alexandrium minutum during a simulated marine heatwave","BIOGEOSCIENCES","","1726-4170","10.5194/bg-16-4377-2019",NA,"The biogenic sulfur compounds dimethyl sulfide (DMS), dimethyl sulfoniopropionate (DMSP) and dimethyl sulfoxide (DMSO) are produced and transformed by diverse populations of marine microorganisms and have substantial physiological, ecological and biogeochemical importance spanning organism to global scales. Understanding the production and transformation dynamics of these compounds under shifting environmental conditions is important for predicting their roles in a changing ocean. Here, we report the physiological and biochemical response of a robust strain of Alexandrium minutum, a dinoflagellate with the highest reported intracellular DMSP content, exposed to a 6 d increase in temperature mimicking mild and extreme coastal marine heatwave conditions (+4 and +12 degrees C). Under mild temperature increases (+4 degrees C), A. minutum growth was enhanced, with no measurable physiological stress response. However, under a very acute increase in temperature (+12 degrees C) triggering thermal stress, A. minutum growth declined, photosynthetic efficiency (F-V/F-M) was impaired, and enhanced oxidative stress was observed. These physiological responses indicative of thermal stress were accompanied by increased DMS and DMSO concentrations followed by decreased DMSP concentration. At this temperature extreme, we observed a cascading stress response in A. minutum, which was initiated 6 h after the start of the experiment by a spike in DMS and DMSO concentrations and a rapid decrease in F-V/F-M. This was followed by an increase in reactive oxygen species (ROS) and an abrupt decline in DMS and DMSO on day 2 of the experiment. A subsequent decrease in DMSP coupled with a decline in the growth rate of both A. minutum and its associated total bacterial assemblage coincided with a shift in the composition of the A. minutum microbiome. Specifically, an increase in the relative abundance of the operational taxonomic units (OTUs) matching Oceanicaulis (17.0 %), Phycisphaeraceae SM1A02 (8.8 %) and Balneola (4.9 %) as well as a decreased relative abundance of Maribacter (24.4 %), Marinoscillum (4.7 %) and Seohaeicola (2.7 %) were primarily responsible for differences in microbiome structure observed between temperature treatments. These shifts in microbiome structure are likely to have been driven by either the temperature itself, the changing physiological state of A. minutum cells, shifts in biogenic sulfur concentrations, the presence of other solutes, or a combination of all. Nevertheless, we suggest that these results point to the significant effect of extreme heatwaves on the physiology, growth and microbiome composition of the redtide causing dinoflagellate A. minutum, as well as potential implications for biogenic sulfur cycling processes and marine DMS emissions.","2019-11-19","2025-03-05 14:40:27","2025-03-05 14:40:27",NA,"4377-4391",NA,"22",16,NA,NA,NA,"",NA,NA,NA,NA,NA,"English",NA,NA,NA,"WOS:000498640300001",NA,NA,"","<p>Times Cited in Web of Science Core Collection:&nbsp;&nbsp;9<br/>Total Times Cited:&nbsp;&nbsp;11<br/>Cited Reference Count:&nbsp;&nbsp;68</p>",NA,NA,"ATMOSPHERIC SULFUR; CLIMATE-CHANGE; DIMETHYLSULFONIOPROPIONATE DMSP CONCENTRATION; DIMETHYLSULFOXIDE DMSO; FORAGING CUE; LYASE ACTIVITY; PHYTOPLANKTON; STRESS; SULFIDE; TEMPERATURE",NA,"",NA,NA,NA,NA,NA,NA,NA,NA,NA,NA,NA,NA,NA,NA,NA,NA,NA,NA,NA,NA,NA,NA,NA,NA,NA,NA,NA,NA,NA,NA,NA,NA,NA,NA,NA,NA,NA,NA,NA,NA,NA,NA,NA,NA,NA,"Accept","No reason given","No comments given","Insert Screener Name","Dinoflagellates"
"LMR2FDNH","journalArticle",2016,"Hu, ZX; Mulholland, MR; Xu, N; Duan, SS","Effects of temperature, irradiance and pCO2 on the growth and nitrogen utilization of Prorocentrum donghaiense","AQUATIC MICROBIAL ECOLOGY","","0948-3055","10.3354/ame01793",NA,"Environmental factors such as temp erature, irradiance, and nitrogen (N) supply affect the growth of Prorocentrum donghaiense, but the interactive effects of these physical factors and the effects of atmospheric CO2 (pCO(2)) on growth and N uptake have not been examined. We compared growth kinetics of P. donghaiense grown on 4 different N substrates (nitrate [NO3-], ammonium [NH4+], urea, and glutamic acid [glu]) with respect to temperature, irradiance, and pCO(2). Temperature (15 to 30 degrees C) had a positive effect on growth (max. growth rates: 0.17 to 0.65 d(-1); optimal temperature: 25 to 30 degrees C); maximum specific growth rates (mu(max)) declined when cultures were grown at 30 degrees C. P. donghaiense grew well on all 4 N sources, under irradiances ranging from 10 to 180 mu mol quanta m(-2) s(-1). mu(max) (2.0 +/- 0.1 d(-1)) was observed in cultures growing with NH4+ as the sole N source in the highest irradiance treatment (180 mu mol quanta m(-2) s(-1)). These rates were significantly higher than those measured in cultures grown on NO3-, urea, and glu (all similar to 1.4 d(-1)). Half-saturation constants (K-s) ranged from 66.5 +/- 4.6 to 99.4 +/- 6.7 mu mol quanta m(-2) s(-1) for cultures grown with glu or NH4+, respectively, as the sole source of N. Both growth and N uptake rates were higher in cultures grown under elevated pCO(2). Our results suggest that P. donghaiense exhibits flexible adaptation for N utilization under broad environmental conditions (temperature, irradiance, pCO(2)), which may play an important role in the formation and duration of P. donghaiense blooms.","2016","2025-03-05 14:40:27","2025-03-05 14:40:27",NA,"155-166",NA,"3",77,NA,NA,NA,"",NA,NA,NA,NA,NA,"English",NA,NA,NA,"WOS:000387120300003",NA,NA,"","<p>Times Cited in Web of Science Core Collection:&nbsp;&nbsp;9<br/>Total Times Cited:&nbsp;&nbsp;10<br/>Cited Reference Count:&nbsp;&nbsp;90</p>",NA,NA,"CARBON UPTAKE; CLIMATE-CHANGE; CO2; DINOFLAGELLATE BLOOMS; ELEMENTAL RATIOS; GLOBAL EXPANSION; Growth rate; GYMNODINIUM-CATENATUM DINOPHYCEAE; HARMFUL ALGAL BLOOMS; Irradiance; MARINE-PHYTOPLANKTON; NITRATE UPTAKE; Nitrogen; Nitrogen uptake; Prorocentrum donghaiense; Temperature; UPTAKE KINETICS",NA,"",NA,NA,NA,NA,NA,NA,NA,NA,NA,NA,NA,NA,NA,NA,NA,NA,NA,NA,NA,NA,NA,NA,NA,NA,NA,NA,NA,NA,NA,NA,NA,NA,NA,NA,NA,NA,NA,NA,NA,NA,NA,NA,NA,NA,NA,"Accept","No reason given","No comments given","Insert Screener Name","Dinoflagellates"
"5XVI46WG","journalArticle",2022,"Ok, JH; Jeong, HJ; Kang, HC; Park, SA; Eom, SH; You, JH; Lee, SY","Ecophysiology of the kleptoplastidic dinoflagellate Shimiella gracilenta: II. Effects of temperature and global warming","ALGAE","","1226-2617","10.4490/algae.2022.37.3.2",NA,"Water temperature affects plankton survival and growth. The dinoflagellate Shimiella gracilenta survives using the plastids of ingested prey, indicating kleptoplastidy. However, studies on the effects of water temperature on kleptoplastidic dinoflagellates are lacking. We explored the growth and ingestion rates of S. gracilenta as a function of water temperature. Furthermore, using data on its spatiotemporal distribution in Korean coastal waters during 2015-2018, we predicted its distribution under elevated temperature conditions of +2, +4, and +6 degrees C. Growth rates of S. gracilenta with and without Teleaulax amphioxeia prey as well as ingestion rates were significantly affected by water temperature. Growth rates of S. gracilenta with and without prey were positive or zero at 5-25 degrees C but were negative at >= 30 degrees C. The maximum growth rate of S. gracilenta with T. amphioxeia was 0.85 d(-1), achieved at 25 degrees C, and 0.21 d(-1) at 20 degrees C without prey. The ingestion rate of S. gracilenta on T. amphioxeia at 25 degrees C (0.05 ng C predator(-1) d(-1)) was greater than that at 20 degrees C (0.04 ng C predator(-1) d(-1)). Thus, feeding may shift the optimal temperature for the maximum growth rate of S. gracilenta from 20 to 25 degrees C. In spring and winter, the distributions of S. gracilenta under elevated temperature conditions were predicted not to differ from those during 2015-2018. However, S. gracilenta was predicted not to survive at some additional stations under elevated temperature conditions of +2, +4, and +6 degrees C in summer or under elevated temperature conditions of +6 degrees C in autumn. Therefore, global warming may affect the distribution of S. gracilenta.","2022-03","2025-03-05 14:40:27","2025-03-05 14:40:27",NA,"49-62",NA,"1",37,NA,NA,NA,"",NA,NA,NA,NA,NA,"English",NA,NA,NA,"WOS:000789108500004",NA,NA,"","<p>Times Cited in Web of Science Core Collection:&nbsp;&nbsp;6<br/>Total Times Cited:&nbsp;&nbsp;6<br/>Cited Reference Count:&nbsp;&nbsp;71</p>",NA,NA,"climate change; CLIMATE-CHANGE; distribution; ECOLOGICAL ROLES; GRAZING IMPACT; Gymnodinium gracilentum; heatwave; HETEROTROPHIC PROTISTS; INGESTION RATES; Kareniaceae; KOREAN COASTAL WATERS; LIGHT-INTENSITY; mixotroph; prediction; protist; RED-TIDE ORGANISMS; SOUTH SEA; YIHIELLA-YEOSUENSIS",NA,"",NA,NA,NA,NA,NA,NA,NA,NA,NA,NA,NA,NA,NA,NA,NA,NA,NA,NA,NA,NA,NA,NA,NA,NA,NA,NA,NA,NA,NA,NA,NA,NA,NA,NA,NA,NA,NA,NA,NA,NA,NA,NA,NA,NA,NA,"Accept","No reason given","No comments given","Insert Screener Name","Dinoflagellates"
"ETJWZESC","journalArticle",2021,"Sala-Pérez, M; Lockyer, AE; Anesio, A; Leroy, SAG","Effect of temperature and salinity on the growth and cell size of the first cultures of Gymnodinium aureolum from the Black Sea","BOTANICA MARINA","","0006-8055","10.1515/bot-2020-0076",NA,"Algal blooms are natural phenomena that may cause human health problems, millions of dollars in losses and ecological disasters worldwide. Anthropogenic pressures like eutrophication may increase the frequency and intensity of these phenomena. The Black Sea is characterized by rapid changes in salinity and temperature in surface waters. In addition, it has suffered increasing environmental pressure from human activities. This work presents the first cultures of Gymnodinium aureolum to be isolated from the Black Sea. Morphological and phylogenetic analyses confirmed our strain as G. aureolum. The effects of temperature and salinity on growth were tested in experiments combining two temperatures and five salinities in 10 experimental treatments. This provides baseline data on the physiological adaption and acclimatization potential of the species to bloom under present and future climatic scenarios in the Black Sea. Gymnodinium aureolum grew exponentially in all experimental treatments, except for cultures at salinity 5. Growth rate increased significantly with increasing temperature reaching the maximum at 20 degrees C and salinity 15 (0.38 +/- 0.02 d(-1)). This suggests an adaptation to the salinity and temperature of Black Sea waters and, together with previous records of G. aureolum in both water and sediments, supports the idea that this may be a bloom-forming population of G. aureolum.","2021","2025-03-05 14:40:27","2025-03-05 14:40:27",NA,"201-210",NA,"3",64,NA,NA,NA,"",NA,NA,NA,NA,NA,"English",NA,NA,NA,"WOS:000660531300004",NA,NA,"","<p>Times Cited in Web of Science Core Collection:&nbsp;&nbsp;1<br/>Total Times Cited:&nbsp;&nbsp;1<br/>Cited Reference Count:&nbsp;&nbsp;65</p>",NA,NA,"algal bloom; CLIMATE-CHANGE; COASTAL WATERS; dinoflagellate culture; DINOPHYCEAE; GENETIC-VARIABILITY; growth rate; HARMFUL ALGAL BLOOMS; MARINE-PHYTOPLANKTON; MIKIMOTOI; NITROGEN; PHYLOGENETIC ANALYSIS; phylogeny; PHYTOPLANKTON COMMUNITY",NA,"",NA,NA,NA,NA,NA,NA,NA,NA,NA,NA,NA,NA,NA,NA,NA,NA,NA,NA,NA,NA,NA,NA,NA,NA,NA,NA,NA,NA,NA,NA,NA,NA,NA,NA,NA,NA,NA,NA,NA,NA,NA,NA,NA,NA,NA,"Accept","No reason given","No comments given","Insert Screener Name","Dinoflagellates"
